{
  "id": "zh-a1-u01-l01",
  "language": "zh",
  "native_language": "en",
  "level": "A1",
  "unit": "greetings-introductions",
  "title": "Say hello",
  "objectives": ["greet-someone", "say-goodbye"],
  "vocabulary": [
    {
      "id": "zh-nihao",
      "text": "你好",
      "transliteration": "nǐ hǎo",
      "translation_en": "hello",
      "audio": null,
      "image": null,
      "word_by_word_gloss": "you + good"
    },
    {
      "id": "zh-zaijian",
      "text": "再见",
      "transliteration": "zài jiàn",
      "translation_en": "goodbye",
      "audio": null,
      "image": null,
      "word_by_word_gloss": "again + see"
    }
  ],
  "grammar_point": null,
  "dialogues": [
    {
      "id": "hello-goodbye",
      "lines": [
        { "speaker": "A", "text": "你好！", "transliteration": "Nǐ hǎo!", "translation_en": "Hello!" },
        { "speaker": "B", "text": "再见！", "transliteration": "Zàijiàn!", "translation_en": "Goodbye!" }
      ]
    }
  ],
  "exercises": [
    {
      "id": "l01-mc-hello",
      "type": "multiple_choice",
      "skill": ["reading", "vocabulary"],
      "objective_id": "greet-someone",
      "difficulty": 1,
      "prompt": "What does 你好 mean?",
      "answer_key": "hello",
      "accepted_variants": ["hi"],
      "explanation": "你好 is a common way to say hello.",
      "explain_more": "你好 is made of 你 (you) and 好 (good). It is a common greeting. The answer key is fixed lesson data; Ira does not decide whether an answer is correct.",
      "hint": "This is a greeting.",
      "options": ["hello", "goodbye", "thank you"]
    },
    {
      "id": "l01-listen-choose-hello",
      "type": "listen_and_choose",
      "skill": ["listening", "vocabulary"],
      "objective_id": "greet-someone",
      "difficulty": 1,
      "prompt": "Listen to the greeting. What does it mean?",
      "listen_text": "你好！",
      "answer_key": "hello",
      "accepted_variants": ["hi"],
      "explanation": "你好！is a greeting meaning hello.",
      "explain_more": "Listen for nǐ hǎo. This sample uses your browser’s available Chinese speech voice and does not include recorded audio.",
      "hint": "You might say this when you meet someone.",
      "options": ["hello", "goodbye", "thank you"]
    },
    {
      "id": "l01-listen-type-hello",
      "type": "listen_and_type",
      "skill": ["listening", "writing"],
      "objective_id": "greet-someone",
      "difficulty": 1,
      "prompt": "Listen and type the Mandarin greeting in characters.",
      "listen_text": "你好！",
      "answer_key": "你好！",
      "accepted_variants": ["你好"],
      "explanation": "The greeting is 你好！",
      "explain_more": "The characters are 你 (nǐ, you) and 好 (hǎo, good). Punctuation is optional in this answer.",
      "hint": "It has two characters."
    },
    {
      "id": "l01-fill-farewell",
      "type": "fill_blank",
      "skill": ["writing", "vocabulary"],
      "objective_id": "say-goodbye",
      "difficulty": 1,
      "prompt": "Complete the farewell: 再___！",
      "answer_key": "见",
      "accepted_variants": [],
      "explanation": "再见 is a common way to say goodbye.",
      "explain_more": "The phrase 再见 is made of 再 (again) and 见 (see).",
      "hint": "The missing character means “see”."
    },
    {
      "id": "l01-build-farewell",
      "type": "sentence_building",
      "skill": ["writing", "vocabulary"],
      "objective_id": "say-goodbye",
      "difficulty": 1,
      "prompt": "Build the Mandarin word for “goodbye”.",
      "answer_key": "再见！",
      "accepted_variants": ["再见"],
      "explanation": "再见！means goodbye.",
      "explain_more": "Place 再 before 见 to build 再见. The exclamation mark is optional.",
      "hint": "The first character is 再.",
      "options": ["见", "再", "！"]
    },
    {
      "id": "l01-translate-hello",
      "type": "translate_native_to_target",
      "skill": ["writing", "vocabulary"],
      "objective_id": "greet-someone",
      "difficulty": 1,
      "prompt": "Translate into Mandarin: Hello!",
      "answer_key": "你好！",
      "accepted_variants": ["你好"],
      "explanation": "你好！is a common greeting.",
      "explain_more": "The answer uses the greeting from the lesson. Punctuation is optional.",
      "hint": "The phrase has two characters."
    },
    {
      "id": "l01-translate-goodbye",
      "type": "translate_target_to_native",
      "skill": ["reading", "vocabulary"],
      "objective_id": "say-goodbye",
      "difficulty": 1,
      "prompt": "What does 再见 mean in English?",
      "answer_key": "goodbye",
      "accepted_variants": ["bye"],
      "explanation": "再见 means goodbye.",
      "explain_more": "再见 is a farewell. Its word-by-word gloss in this sample is “again + see”.",
      "hint": "You say this when leaving."
    },
    {
      "id": "l01-match-greetings",
      "type": "match_pairs",
      "skill": ["reading", "vocabulary"],
      "objective_id": "greet-someone",
      "difficulty": 1,
      "prompt": "Match each Mandarin phrase with its meaning.",
      "answer_key": {
        "你好": "hello",
        "再见": "goodbye"
      },
      "accepted_variants": [],
      "explanation": "你好 means hello, and 再见 means goodbye.",
      "explain_more": "Use the greeting 你好 when meeting someone and 再见 when saying goodbye.",
      "hint": "One phrase is used when meeting; the other is used when leaving."
    },
    {
      "id": "l01-spot-mistake-pairing",
      "type": "spot_mistake",
      "skill": ["reading", "vocabulary"],
      "objective_id": "say-goodbye",
      "difficulty": 1,
      "prompt": "Which phrase-and-meaning pair has a mistake?",
      "answer_key": "再见 = hello",
      "accepted_variants": [],
      "explanation": "再见 means goodbye, not hello.",
      "explain_more": "你好 is the greeting. 再见 is the farewell.",
      "hint": "Find the phrase you use when leaving.",
      "options": ["你好 = hello", "再见 = hello", "再见 = goodbye"]
    }
  ],
  "roleplay": {
    "id": "meet-someone-zh-a1",
    "level": "A1",
    "title": "Meet someone",
    "goal": "Greet someone and say goodbye.",
    "success_criteria": ["Uses a greeting", "Uses a farewell"],
    "useful_phrases": []
  },
  "whiteboard_cards": [
    {
      "id": "hello-card",
      "type": "vocab_card",
      "title": "Hello",
      "word": "你好",
      "transliteration": "nǐ hǎo",
      "translation": "hello",
      "example_sentence": "你好！"
    }
  ],
  "reviewed": false
}
